{
  "schemaVersion": 1,
  "workloadId": "game.ecs-frame-update.v1",
  "catalogBinding": {
    "catalogId": "workload-catalog-v1",
    "path": "catalog/workloads.v1.json",
    "catalogSha256": "6665664f984683e5b7d3fdc8c1602198124844704c224a526d48be2f02edf9d4",
    "mutationPolicy": "byte-for-byte-frozen"
  },
  "status": "implementation-candidate",
  "source": {
    "repository": "https://github.com/PaulKinlan/wasm-vs-js",
    "commit": "ef8ea1e4021bad15384a350aba1b76d0ca540f91",
    "references": [
      {
        "path": "benchmarks/v1/game-ecs-frame-update/fixture.js",
        "sha256": "9201f7ac4a33eb6b79139d648d47fb9cdc2c3b86a84833e3fbee43ba4bd860a5",
        "immutableUrl": "https://github.com/PaulKinlan/wasm-vs-js/blob/ef8ea1e4021bad15384a350aba1b76d0ca540f91/benchmarks/v1/game-ecs-frame-update/fixture.js"
      },
      {
        "path": "benchmarks/v1/game-ecs-frame-update/engine.js",
        "sha256": "b676849d13e658445c9621af9a29156c9bae5767216c02714ab2cb1608dac3b1",
        "immutableUrl": "https://github.com/PaulKinlan/wasm-vs-js/blob/ef8ea1e4021bad15384a350aba1b76d0ca540f91/benchmarks/v1/game-ecs-frame-update/engine.js"
      },
      {
        "path": "benchmarks/v1/game-ecs-frame-update/ecs-frame-update.c",
        "sha256": "817cb7a508007f003a98262c88e30d9f59a53a9f92d0b9ac747dd28e1289f899",
        "immutableUrl": "https://github.com/PaulKinlan/wasm-vs-js/blob/ef8ea1e4021bad15384a350aba1b76d0ca540f91/benchmarks/v1/game-ecs-frame-update/ecs-frame-update.c"
      },
      {
        "path": "benchmarks/v1/game-ecs-frame-update/implementation-contract.v1.json",
        "sha256": "a46282dd0b70e8acf5d3e7d342d316a721e92a14fe9d5b20ba86302d5c2d9370",
        "immutableUrl": "https://github.com/PaulKinlan/wasm-vs-js/blob/ef8ea1e4021bad15384a350aba1b76d0ca540f91/benchmarks/v1/game-ecs-frame-update/implementation-contract.v1.json"
      },
      {
        "path": "scripts/build-base-game-ecs-frame-update.ts",
        "sha256": "7fd1fe56f0c41ecb3fc8775c4b1bf2f02d53700cb7f8b244a928a54d4c00b344",
        "immutableUrl": "https://github.com/PaulKinlan/wasm-vs-js/blob/ef8ea1e4021bad15384a350aba1b76d0ca540f91/scripts/build-base-game-ecs-frame-update.ts"
      },
      {
        "path": "schemas/game-ecs-frame-update-implementation.v1.schema.json",
        "sha256": "13638fa39f062595f737c3361caf427028f65a2582e35a9408113c9f7f1ffc88",
        "immutableUrl": "https://github.com/PaulKinlan/wasm-vs-js/blob/ef8ea1e4021bad15384a350aba1b76d0ca540f91/schemas/game-ecs-frame-update-implementation.v1.schema.json"
      },
      {
        "path": "public/benchmarks/game-ecs-frame-update/index.html",
        "sha256": "d15d870d0f039df0c9382cc7e4c860757e17ec5d5c0537f35712de7263fca4f2",
        "immutableUrl": "https://github.com/PaulKinlan/wasm-vs-js/blob/ef8ea1e4021bad15384a350aba1b76d0ca540f91/public/benchmarks/game-ecs-frame-update/index.html"
      },
      {
        "path": "public/demos/game-ecs-frame-update/demo.js",
        "sha256": "4dc9cfc6bd448344222e242de0c3cbf5e524ed0323fc6084347c93c0ec55b1f1",
        "immutableUrl": "https://github.com/PaulKinlan/wasm-vs-js/blob/ef8ea1e4021bad15384a350aba1b76d0ca540f91/public/demos/game-ecs-frame-update/demo.js"
      },
      {
        "path": "public/demos/game-ecs-frame-update/worker.js",
        "sha256": "4f357fff4bf3b1c2ed4cba3277eaa1bdc2c2e50f6b952508c516230322b421c8",
        "immutableUrl": "https://github.com/PaulKinlan/wasm-vs-js/blob/ef8ea1e4021bad15384a350aba1b76d0ca540f91/public/demos/game-ecs-frame-update/worker.js"
      },
      {
        "path": "server.ts",
        "sha256": "5e40bb1e787fc8012e7cac8e29527f28525a2f32f4a59216c4b24e9623d0a8f8",
        "immutableUrl": "https://github.com/PaulKinlan/wasm-vs-js/blob/ef8ea1e4021bad15384a350aba1b76d0ca540f91/server.ts"
      },
      {
        "path": "catalog/workloads.v1.json",
        "sha256": "6665664f984683e5b7d3fdc8c1602198124844704c224a526d48be2f02edf9d4",
        "immutableUrl": "https://github.com/PaulKinlan/wasm-vs-js/blob/ef8ea1e4021bad15384a350aba1b76d0ca540f91/catalog/workloads.v1.json"
      },
      {
        "path": "deno.json",
        "sha256": "1fb796ab0a517cac5b34d6b0225dc1316f7dae952460c45fec46acbe9d71ec5b",
        "immutableUrl": "https://github.com/PaulKinlan/wasm-vs-js/blob/ef8ea1e4021bad15384a350aba1b76d0ca540f91/deno.json"
      },
      {
        "path": "deno.lock",
        "sha256": "e468ccbdd168f790d69e2d180a264a52602ca8a06fe9f7a84fca2ca717c123b2",
        "immutableUrl": "https://github.com/PaulKinlan/wasm-vs-js/blob/ef8ea1e4021bad15384a350aba1b76d0ca540f91/deno.lock"
      }
    ]
  },
  "fixture": {
    "path": "public/artifacts/game-ecs-frame-update-v1/fixture.bin",
    "bytes": 81016,
    "sha256": "9ad7ed255f244425f3da0d281f7dffcaa8a8923e03907d5ac0bf0322968df769",
    "licenseSpdx": "CC0-1.0",
    "redistribution": "permitted",
    "entities": 10000,
    "frames": 1000,
    "seed": 1858462077
  },
  "oracle": {
    "kind": "canonical-semantic",
    "algorithmFamily": "ecs-fixed-system-order",
    "integerTolerance": 0,
    "finalStateWords": 60000,
    "finalStateDigest": "4f0cc1ca",
    "checkpointDigest": "434e9372",
    "semanticDigest": "fe967b61",
    "counters": {
      "frames": 1000,
      "entities": 10000,
      "systemPasses": 3000,
      "movementUpdates": 10000000,
      "broadphaseCellClears": 16384000,
      "broadphaseCellScans": 81920000,
      "broadphaseInsertions": 10000000,
      "pairTests": 27086270,
      "collisions": 8538,
      "animationUpdates": 10000000,
      "controlMutations": 77862,
      "stateMutations": 30113243,
      "checkpointCount": 10,
      "inputBytes": 81016,
      "outputBytes": 240128
    }
  },
  "build": {
    "artifact": "public/artifacts/game-ecs-frame-update-v1/ecs-frame-update.wasm",
    "artifactSha256": "e76d6c13392a6cb2d570d14c03de0147528a84267b7d527a84209f3b7d79b12f",
    "recipe": "scripts/build-base-game-ecs-frame-update.ts",
    "deno": "2.9.0",
    "clang": "clang version 22.1.8",
    "wasmLd": "LLD 22.1.8",
    "compilerFlags": [
      "--target=wasm32-unknown-unknown",
      "-O3",
      "-nostdlib",
      "-ffreestanding",
      "-fno-builtin"
    ],
    "linkerFlags": [
      "--no-entry",
      "--export-memory",
      "--export=input_ptr",
      "--export=result_ptr",
      "--export=run",
      "--initial-memory=1048576",
      "--max-memory=1048576",
      "--stack-first"
    ],
    "memoryBytes": 1048576
  },
  "variants": [
    {
      "id": "js-controlled",
      "target": "javascript",
      "status": "passed",
      "evidence": "public/evidence/base-v1/game-ecs-frame-update-v1/js-controlled.json"
    },
    {
      "id": "wasm-linear-controlled",
      "target": "wasm-linear",
      "status": "passed",
      "evidence": "public/evidence/base-v1/game-ecs-frame-update-v1/wasm-linear-controlled.json"
    }
  ],
  "demo": {
    "route": "/benchmarks/game-ecs-frame-update/",
    "status": "runnable-correctness",
    "timeoutMs": 120000,
    "persistence": false,
    "upload": false,
    "ranking": false
  },
  "performanceClaims": []
}
